{
  "kind": "bibleapp:physical-pack-catalog",
  "schema_version": 1,
  "catalog_version": "fixture-v2",
  "generated_at": "2026-08-21T00:00:00.000Z",
  "package_identity": {
    "schema_version": 1,
    "package_id": "reader-texts",
    "content_sha256": "sha256:597d66f4d51bec8244423c05ea56c8f3a08dfaebcdeb64db866eea1a0529dde9"
  },
  "compatibility": {
    "minimum_app_version": "1.0.0",
    "maximum_app_version_exclusive": "2.0.0"
  },
  "packs": [
    {
      "pack_id": "search-verses",
      "pack_version": "fixture-v2",
      "manifest_path": "packs/search-verses/fixture-v2/manifest.json",
      "manifest_sha256": "sha256:b61f72cb6a79912a8729fb0f3b869c194df2dbab9d970566dc560b9146a83506",
      "dependencies": [],
      "provided_capabilities": [
        "search"
      ],
      "files": 2,
      "bytes": 365,
      "transfer_bytes": 365,
      "license_note": "Deterministic lifecycle fixture only; production source rights remain governed by NOTICE.md.",
      "notice_path": "NOTICE.md",
      "source_manifest_path": "data/source-manifest.json",
      "source_refs": [
        "source_package"
      ]
    },
    {
      "pack_id": "commentary-verse-index",
      "pack_version": "fixture-v1",
      "manifest_path": "packs/commentary-verse-index/fixture-v1/manifest.json",
      "manifest_sha256": "sha256:e6d0bbc97e7d0a099e372f06c9df2124edb923cd1555e7a791d7f7fd03811e4c",
      "dependencies": [
        "search-verses"
      ],
      "provided_capabilities": [
        "commentary"
      ],
      "files": 1,
      "bytes": 195,
      "transfer_bytes": 195,
      "license_note": "Deterministic lifecycle fixture only; production source rights remain governed by NOTICE.md.",
      "notice_path": "NOTICE.md",
      "source_manifest_path": "data/source-manifest.json",
      "source_refs": [
        "source_package"
      ]
    }
  ],
  "full_offline_bundle": {
    "pack_ids": [
      "search-verses",
      "commentary-verse-index"
    ],
    "complete_offline": true
  }
}
